,Company,Valuation ($B),Date Joined,Country,City,Industry,Select Investors,Year Joined,Investor_1,Investor_2,Investor_3,Investor_4
433,Trendy Group International,2.0,2012-02-13,Hong Kong,Kowloon,Consumer & Retail,L Capital Partners,2012,L Capital Partners,,,
434,GrubMarket,2.0,2021-09-14,United States,San Francisco,Consumer & Retail,"GGV Capital, BlackRock, ACE & Company",2021,GGV Capital, BlackRock, ACE & Company,
435,BeZero,2.0,2022-11-14,United Kingdom,London,Enterprise Tech,"Contrarian Ventures, Molten Ventures, Hitachi Ventures 32",2022,Contrarian Ventures, Molten Ventures, Hitachi Ventures 32,
436,Cohere,2.0,2023-05-02,Canada,Toronto,Enterprise Tech,"Index Ventures, Salesforce Ventures, Section 32",2023,Index Ventures, Salesforce Ventures, Section 32,
437,GO1,2.0,2021-07-19,Australia,Brisbane,Enterprise Tech,"Y Combinator, M12, SEEK",2021,Y Combinator, M12, SEEK,
438,Clear Street,2.0,2022-04-29,United States,New York,Financial Services,"NextGen Venture Partners, Prysm Capital, McLaren Strategic Ventures",2022,NextGen Venture Partners, Prysm Capital, McLaren Strategic Ventures,
439,Drata,2.0,2021-11-08,United States,San Diego,Enterprise Tech,"Cowboy Ventures, Leaders Fund, GGV Capital",2021,Cowboy Ventures, Leaders Fund, GGV Capital,
440,Mysten Labs,2.0,2022-09-08,United States,San Francisco,Enterprise Tech,"Andreessen Horowitz, Coinbase Ventures, Circle Ventures",2022,Andreessen Horowitz, Coinbase Ventures, Circle Ventures,
441,Avant,2.0,2012-12-17,United States,Chicago,Financial Services,"RRE Ventures, Tiger Global, August Capital",2012,RRE Ventures, Tiger Global, August Capital,
442,Tubatu.com,2.0,2015-03-09,China,Shenzhen,Consumer & Retail,"Sequoia Capital China, Matrix Partners China, 58.com",2015,Sequoia Capital China, Matrix Partners China, 58.com,
443,BlaBlaCar,2.0,2015-09-16,France,Paris,Consumer & Retail,"Accel Partners, Index Ventures, Insight Venture Partners",2015,Accel Partners, Index Ventures, Insight Venture Partners,
444,HuiMin,2.0,2016-09-05,China,Beijing,Consumer & Retail,"Zheshang Venture Capital, GP Capital, Western Capital Management",2016,Zheshang Venture Capital, GP Capital, Western Capital Management,
445,Preferred Networks,2.0,2018-05-17,Japan,Tokyo,Industrials,"Toyota Motor Corporation, Mizuho Financial Group, FANUC",2018,Toyota Motor Corporation, Mizuho Financial Group, FANUC,
446,Formlabs,2.0,2018-08-01,United States,Somerville,Industrials,"Pitango Venture Capital, DFJ Growth Fund, Foundry Group",2018,Pitango Venture Capital, DFJ Growth Fund, Foundry Group,
447,Calm,2.0,2019-02-06,United States,San Francisco,Healthcare & Life Sciences,"Insight Venture Partners, TPG Growth, Sound Ventures",2019,Insight Venture Partners, TPG Growth, Sound Ventures,
448,Kaseya,2.0,2019-03-27,United States,Miami,Enterprise Tech,"Insight Partners, TPG Alternative & Renewable Technologies, Ireland Strategic Investment Fund",2019,Insight Partners, TPG Alternative & Renewable Technologies, Ireland Strategic Investment Fund,
449,Mafengwo,2.0,2019-05-23,China,Beijing,Consumer & Retail,"Qiming Venture Partners, Capital Today, General Atlantic",2019,Qiming Venture Partners, Capital Today, General Atlantic,
450,Druva,2.0,2019-06-20,United States,Sunnyvale,Enterprise Tech,"Nexus Venture Partners, Tenaya Capital, Sequoia Capital",2019,Nexus Venture Partners, Tenaya Capital, Sequoia Capital,
451,Kujiale,2.0,2019-10-25,China,Hangzhou,Consumer & Retail,"GGV Capital, IDG Capital, Linear Venture",2019,GGV Capital, IDG Capital, Linear Venture,
452,AppsFlyer,2.0,2020-01-21,United States,San Francisco,Enterprise Tech,"Magma Venture Partners, Pitango Venture Capital, Qumra Capital",2020,Magma Venture Partners, Pitango Venture Capital, Qumra Capital,
453,Redis,2.0,2020-08-25,United States,Mountain View,Enterprise Tech,"Viola Ventures, Dell Technologies Capital, Bain Capital Ventures",2020,Viola Ventures, Dell Technologies Capital, Bain Capital Ventures,
454,Xingyun Group,2.0,2020-09-24,China,Shenzhen,Consumer & Retail,"Matrix Partners China, Eastern Bell Capital, Hongtai Capital Holdings",2020,Matrix Partners China, Eastern Bell Capital, Hongtai Capital Holdings,
455,Unqork,2.0,2020-10-06,United States,New York,Insurance,"Blackrock, capitalG, World Lab Innovation",2020,Blackrock, capitalG, World Lab Innovation,
456,Virta Health,2.0,2020-12-02,United States,San Francisco,Healthcare & Life Sciences,"Caffeinated Capital, Obvious Ventures, Venrock",2020,Caffeinated Capital, Obvious Ventures, Venrock,
457,ISN,2.0,2020-12-17,United States,Dallas,Industrials,Blackstone,2020,Blackstone,,,
458,Earnix,2.0,2021-02-21,Israel,Giv'atayim,Insurance,"Jerusalem Venture Partners, Israel Growth Partners, Insight Partners",2021,Jerusalem Venture Partners, Israel Growth Partners, Insight Partners,
459,Clearco,2.0,2021-04-20,Canada,Toronto,Financial Services,"Highland Capital Partners, Oak HC/FT Partners, Emergence Capital Partners",2021,Highland Capital Partners, Oak HC/FT Partners, Emergence Capital Partners,
460,Hive,2.0,2021-04-21,United States,San Francisco,Enterprise Tech,"Tomales Bay Capital, Bain & Company, General Catalyst",2021,Tomales Bay Capital, Bain & Company, General Catalyst,
461,Kry,2.0,2021-04-27,Sweden,Stockholm,Healthcare & Life Sciences,"Index Ventures, Creandum, Accel",2021,Index Ventures, Creandum, Accel,
462,Kajabi,2.0,2021-05-04,United States,Irvine,Media & Entertainment,"Meritech Capital Partners, Tiger Global Management, Spectrum Equity",2021,Meritech Capital Partners, Tiger Global Management, Spectrum Equity,
463,Ethos,2.7,2021-05-11,United States,San Francisco,Insurance,"Sequoia Capital, Google Ventures, Accel",2021,Sequoia Capital, Google Ventures, Accel,
464,PayFit,2.1,2022-01-06,United Kingdom,London,Enterprise Tech,"Accel, frst, Kima Ventures",2022,Accel, frst, Kima Ventures,
465,Beisen,2.0,2021-05-11,China,Beijing,Enterprise Tech,"Matrix Partners China, Sequoia Capital China, Genesis Capital",2021,Matrix Partners China, Sequoia Capital China, Genesis Capital,
466,Pipe,2.0,2021-05-19,United States,Miami,Financial Services,"next47, MaC Venture Capital, FinVC",2021,next47, MaC Venture Capital, FinVC,
467,Iterable,2.0,2021-06-15,United States,San Francisco,Enterprise Tech,"CRV, Blue Cloud Ventures, Index Ventures",2021,CRV, Blue Cloud Ventures, Index Ventures,
468,Astronergy,1.82,2023-07-25,China,Haining,Industrials,,2023,,,,
469,Bunq,1.8,2021-06-18,Netherlands,Amsterdam,Financial Services,Undisclosed,2021,Undisclosed,,,
470,Quest Global,1.8,2023-08-08,Sigapore,Singapore,Industrials,,2023,,,,
471,Clip,2.0,2021-06-10,Mexico,Mexico City,Financial Services,"Alta Ventures Mexico, General Atlantic, SoftBank Group",2021,Alta Ventures Mexico, General Atlantic, SoftBank Group,
472,Loggi,2.0,2019-06-05,Brazil,Sao Paulo,Industrials,"Qualcomm Ventures, SoftBank Group. Monashees+",2019,Qualcomm Ventures, SoftBank Group. Monashees+,,
473,MURAL,2.0,2021-07-20,United States,San Francisco,Enterprise Tech,"Insight Partners, Tiger Global Management, Gradient Ventures",2021,Insight Partners, Tiger Global Management, Gradient Ventures,
474,OCSiAl,2.0,2019-03-04,Luxembourg,Leudelange,Industrials,"A&NN, Rusnano",2019,A&NN, Rusnano,,
475,Divvy Homes,2.0,2021-08-13,United States,San Francisco,Financial Services,"Andreessen Horowitz, Caffeinated Capital, SciFi VC",2021,Andreessen Horowitz, Caffeinated Capital, SciFi VC,
476,Apeel Sciences,2.0,2020-05-26,United States,Goleta,Consumer & Retail,"Upfront Ventures, Tao Capital Partners, Andreessen Horowitz",2020,Upfront Ventures, Tao Capital Partners, Andreessen Horowitz,
477,Opay,2.0,2021-08-23,Nigeria,Lagos,Financial Services,"Sequoia Capital China, Source Code Capital, Redpoint Ventures China",2021,Sequoia Capital China, Source Code Capital, Redpoint Ventures China,
478,Aviatrix,2.0,2021-09-08,United States,Santa Clara,Enterprise Tech,"Ignition Partners, Formation 8, CRV",2021,Ignition Partners, Formation 8, CRV,
479,SmartNews,2.0,2019-08-05,Japan,Tokyo,Media & Entertainment,"Japan Post Capital, Globis Capital Partners, Atomico",2019,Japan Post Capital, Globis Capital Partners, Atomico,
480,Misfits Market,2.0,2021-04-21,United States,Pennsauken,Consumer & Retail,"Accel, D1 Capita Partners, Greenoaks Capital Management",2021,Accel, D1 Capita Partners, Greenoaks Capital Management,
481,Advance Intelligence Group,2.0,2021-09-23,Singapore,Sigapore,Financial Services,"Vision Plus Capital, GSR Ventures, ZhenFund",2021,Vision Plus Capital, GSR Ventures, ZhenFund,
482,Modern Treasury,2.0,2021-10-06,United States,San Francisco,Financial Services,"Benchmark, Altimeter Capital, Quiet Capital",2021,Benchmark, Altimeter Capital, Quiet Capital,
483,Magic Leap,2.0,2014-10-21,United States,Plantation,Enterprise Tech,"Obvious Ventures, Qualcomm Ventures, Andreessen Horowitz",2014,Obvious Ventures, Qualcomm Ventures, Andreessen Horowitz,
484,ClickHouse,2.0,2021-10-28,United States,Portola Valley,Enterprise Tech,"Lightspeed Venture Partners, Almaz Capital Partners, Altimeter Capital",2021,Lightspeed Venture Partners, Almaz Capital Partners, Altimeter Capital,
485,Everlaw,2.0,2020-03-10,United States,Oakland,Enterprise Tech,"K9 Ventures, Menlo Ventures, Andreessen Horowitz",2020,K9 Ventures, Menlo Ventures, Andreessen Horowitz,
486,Zilch,2.0,2021-11-10,United Kingdom,London,Financial Services,"Gauss Ventures, Ventura Capital, dmg ventures",2021,Gauss Ventures, Ventura Capital, dmg ventures,
487,VerbIT,2.0,2021-06-08,United States,New York,Enterprise Tech,"ClalTech, Vertex Ventures, Oryzn Capital",2021,ClalTech, Vertex Ventures, Oryzn Capital,
488,StarkWare,8.0,2021-11-17,Israel,Netanya,Enterprise Tech,"Sequoia Capital, Paradigm, Pantera Capital",2021,Sequoia Capital, Paradigm, Pantera Capital,
489,Netlify,2.0,2021-11-17,United States,San Francisco,Enterprise Tech,"Andreessen Horowitz, Kleiner Perkins Caufield & Byers, EQT Ventures",2021,Andreessen Horowitz, Kleiner Perkins Caufield & Byers, EQT Ventures,
490,LTK,2.0,2021-11-22,United States,Dallas,Media & Entertainment,"SoftBank Group, Maverick Capital",2021,SoftBank Group, Maverick Capital,,
491,Trax,2.0,2019-07-22,Singapore,Sigapore,Consumer & Retail,"Hopu Investment Management, Boyu Capital, DC Thomson Ventures",2019,Hopu Investment Management, Boyu Capital, DC Thomson Ventures,
492,Exotec,2.0,2022-01-17,France,Croix,Industrials,"Breega Capital, Iris Capital, 360 Capital Partners",2022,Breega Capital, Iris Capital, 360 Capital Partners,
493,Dremio,2.0,2021-01-06,United States,Santa Clara,Enterprise Tech,"Lightspeed Venture Partners, Redpoint Ventures, Norwest Venture Partners",2021,Lightspeed Venture Partners, Redpoint Ventures, Norwest Venture Partners,
494,Akulaku,2.0,2022-02-15,Indonesia,Jakarta,Financial Services,"DCM Ventures, IDG Capital, Siam Commercial Bank",2022,DCM Ventures, IDG Capital, Siam Commercial Bank,
495,Cloudinary,2.0,2022-02-15,United States,Santa Clara,Media & Entertainment,"Blackstone, Bessemer Venture Partners",2022,Blackstone, Bessemer Venture Partners,,
496,Lunar,2.0,2021-07-12,Denmark,Aarhus,Financial Services,"SEED Capital, Greyhound Capital, Socii Capital",2021,SEED Capital, Greyhound Capital, Socii Capital,
497,UpGrad,2.25,2021-08-09,India,Mumbai,Consumer & Retail,"Qualcomm Ventures, Accel, Canaan Partners",2021,Qualcomm Ventures, Accel, Canaan Partners,
498,Salsify,2.0,2022-04-13,United States,Boston,Consumer & Retail,"Matrix Partners, North Bridge Venture Partners, Venrock",2022,Matrix Partners, North Bridge Venture Partners, Venrock,
499,CertiK,2.0,2022-03-31,United States,New York,Enterprise Tech,"Tiger Global Management, Lightspeed Venture Partners, Hillhouse Capital Management",2022,Tiger Global Management, Lightspeed Venture Partners, Hillhouse Capital Management,
500,ROX Motor,2.0,2022-04-29,China,Shanghai,Industrials,"Sequoia Capital China, IDG Capital, Qiming Venture Partners",2022,Sequoia Capital China, IDG Capital, Qiming Venture Partners,
501,Devo Technology,2.0,2021-10-26,United States,Cambridge,Enterprise Tech,"Insight Partners, Kibo Ventures, Bessemer Venture Partners",2021,Insight Partners, Kibo Ventures, Bessemer Venture Partners,
502,ShiftKey,2.0,2023-01-11,United States,Dallas,Healthcare & Life Sciences,Health Velocity Capital,2023,Health Velocity Capital,,,
503,Rimac Automobili,2.0,2022-06-01,Croatia,Sveta Nedelja,Industrials,"Porsche, InvestIndustrial, SoftBank Group",2022,Porsche, InvestIndustrial, SoftBank Group,
504,Geek+,2.0,2018-11-21,China,Beijing,Industrials,"Volcanics Ventures, Vertex Ventures China, Warburg Pincus",2018,Volcanics Ventures, Vertex Ventures China, Warburg Pincus,
505,21.co,2.0,2022-09-06,United States,New York,Financial Services,"Quiet Ventures, ETFS Capital, Collab+Currency",2022,Quiet Ventures, ETFS Capital, Collab+Currency,
506,Solugen,2.0,2021-09-10,United States,Houston,Industrials,"Fifty Years Fund, Refactor Capital, Temasek",2021,Fifty Years Fund, Refactor Capital, Temasek,
