,Company,Valuation ($B),Date Joined,Country,City,Industry,Select Investors,Year Joined,Investor_1,Investor_2,Investor_3,Investor_4
290,Forter,3.0,2020-11-19,United States,New York,Enterprise Tech,"Sequoia Capital Israel, Scale Venture Partners, Commerce Ventures",2020,Sequoia Capital Israel, Scale Venture Partners, Commerce Ventures,
291,Calendly,3.0,2021-01-26,United States,Atlanta,Enterprise Tech,"ICONIQ Capital, OpenView Venture Partners",2021,ICONIQ Capital, OpenView Venture Partners,,
292,BlockFi,3.0,2021-03-11,United States,Jersey City,Financial Services,"ConsenSys Ventures, Valar Ventures, PUC",2021,ConsenSys Ventures, Valar Ventures, PUC,
293,ActiveCampaign,3.0,2021-04-21,United States,Chicago,Enterprise Tech,"Silversmith Capital Partners, Susquehanna Growth Equity, Tiger Global Management",2021,Silversmith Capital Partners, Susquehanna Growth Equity, Tiger Global Management,
294,CMR Surgical,3.0,2019-09-17,United Kingdom,Cambridge,Healthcare & Life Sciences,"Cambridge Innovation Capital, LGT Capital Partners, Escala Capital",2019,Cambridge Innovation Capital, LGT Capital Partners, Escala Capital,
295,Lucid Software,3.0,2021-06-29,United States,South Jordan,Enterprise Tech,"Spectrum Equity, ICONIQ Capital, Grayhawk Capital",2021,Spectrum Equity, ICONIQ Capital, Grayhawk Capital,
296,Age of Learning,3.0,2016-05-03,United States,Glendale,Consumer & Retail,Iconiq Capital,2016,Iconiq Capital,,,
297,Carbon Health,3.0,2021-07-21,United States,San Francisco,Healthcare & Life Sciences,"Brookfield Asset Management, Blackstone, Data Collective",2021,Brookfield Asset Management, Blackstone, Data Collective,
298,Contentful,3.0,2021-07-28,Germany,Berlin,Enterprise Tech,"Balderton Capital, General Catalyst, Tiger Global Management",2021,Balderton Capital, General Catalyst, Tiger Global Management,
299,LaunchDarkly,3.0,2021-08-10,United States,Oakland,Enterprise Tech,"Uncork Capital, Threshold Ventures, Bloomberg Beta",2021,Uncork Capital, Threshold Ventures, Bloomberg Beta,
300,Seismic,3.0,2018-12-18,United States,San Diego,Enterprise Tech,"Jackson Square Ventures, General Atlantic, Lightspeed Venture Partners",2018,Jackson Square Ventures, General Atlantic, Lightspeed Venture Partners,
301,Sky Mavis,3.0,2021-10-04,Vietnam,Ho Chi Minh City,Media & Entertainment,"Fabric Ventures, 500 Global, Standard Crypto",2021,Fabric Ventures, 500 Global, Standard Crypto,
302,Outschool,3.0,2021-04-14,United States,San Francisco,Consumer & Retail,"Uniion Square Ventures, Tiger Global Management, Lightspeed Venture Capital",2021,Uniion Square Ventures, Tiger Global Management, Lightspeed Venture Capital,
303,TradingView,3.0,2021-10-14,United States,Westerville,Financial Services,"Tiger Global Management, Insight Partners, Jump Capital",2021,Tiger Global Management, Insight Partners, Jump Capital,
304,Groww,3.0,2021-04-07,India,Bengaluru,Financial Services,"Tiger Global Management, Sequoia Capital India, Ribbit Capital",2021,Tiger Global Management, Sequoia Capital India, Ribbit Capital,
305,Podium,3.0,2020-04-07,United States,Lehi,Consumer & Retail,"Accel, Summit Partners, Google Ventures",2020,Accel, Summit Partners, Google Ventures,
306,Via,3.5,2020-03-30,United States,New York,Industrials,"83North, RiverPark Ventures, Pitango Venture Capital",2020,83North, RiverPark Ventures, Pitango Venture Capital,
307,Anchorage Digital,3.0,2021-12-15,United States,San Francisco,Financial Services,"Andreessen Horowitz, Blockchain Capital, Lux Capital",2021,Andreessen Horowitz, Blockchain Capital, Lux Capital,
308,Inxeption,3.0,2022-01-13,United States,San Francisco,Industrials,"Coatue Management, BMO Capital, Schonfeld Strategic Advisors",2022,Coatue Management, BMO Capital, Schonfeld Strategic Advisors,
309,Lattice,3.0,2021-03-23,United States,San Francisco,Enterprise Tech,"Khosla Ventures, Thrive Capital, Y Combinator",2021,Khosla Ventures, Thrive Capital, Y Combinator,
310,Flutterwave,3.0,2021-03-09,United States,San Francisco,Financial Services,"Green Visor Capital, CRE Venture Capital, Greycroft",2021,Green Visor Capital, CRE Venture Capital, Greycroft,
311,Amber Group,3.0,2021-06-21,Singapore,Sigapore,Financial Services,"Tiger Global Management, Tiger Brokers, DCM Ventures",2021,Tiger Global Management, Tiger Brokers, DCM Ventures,
312,Cross River Bank,3.0,2022-02-11,United States,Fort Lee,Financial Services,"Battery Ventures, Andreessen Horowitz, Ribbit Capital",2022,Battery Ventures, Andreessen Horowitz, Ribbit Capital,
313,Remote,3.0,2021-07-13,United States,San Francisco,Enterprise Tech,"Index Ventures, Sequoia Capital, General Catalyst",2021,Index Ventures, Sequoia Capital, General Catalyst,
314,Sentry,3.0,2021-02-18,United States,San Francisco,Enterprise Tech,"New Enterprise Associates, Accel, Bond",2021,New Enterprise Associates, Accel, Bond,
315,TERMINUS Technology,2.96,2018-10-25,China,Beijing,Industrials,"China Everbright Limited, IDG Capital, iFLYTEK",2018,China Everbright Limited, IDG Capital, iFLYTEK,
316,Kraken,2.92,2019-06-25,United States,San Francisco,Financial Services,"Bnk To The Future, Trammell Ventures, SBI Investment",2019,Bnk To The Future, Trammell Ventures, SBI Investment,
317,Workrise,2.9,2019-09-30,United States,Austin,Industrials,"Founders Fund, Quantum Energy Partners, Bedrock Capital",2019,Founders Fund, Quantum Energy Partners, Bedrock Capital,
318,BharatPe,2.85,2021-07-30,India,New Delhi,Financial Services,"Insight Partners, Sequoia Capital India, BEENEXT",2021,Insight Partners, Sequoia Capital India, BEENEXT,
319,Gokin Solar,2.88,2022-04-13,China,Zhuhai,Industrials,"IDG Capital, Puluo Capital, Midea Capital",2022,IDG Capital, Puluo Capital, Midea Capital,
320,DriveWealth,2.85,2021-08-20,United States,Chatham,Financial Services,"Point72 Ventures, Route 66 Ventures, Accel",2021,Point72 Ventures, Route 66 Ventures, Accel,
321,Meicai,2.8,2016-06-22,China,Beijing,Consumer & Retail,"Tiger Global Management, Blue Lake Capital, ZhenFund",2016,Tiger Global Management, Blue Lake Capital, ZhenFund,
322,Nutrabolt,2.79,2022-12-08,United States,Austin,Consumer & Retail,MidOcean Partners,2022,MidOcean Partners,,,
323,Baichuan AI,2.77,2024-07-25,China,Haidian,Enterprise Tech,"Shenzhen Capital Group, Shunwei Capital",2024,Shenzhen Capital Group, Shunwei Capital,,
324,Illumio,2.75,2015-04-14,United States,Sunnyvale,Enterprise Tech,"Data Collective, Formation 8, General Catalyst Partners",2015,Data Collective, Formation 8, General Catalyst Partners,
325,MasterClass,2.75,2021-05-13,United States,San Francisco,Media & Entertainment,"Institutional Venture Partners, New Enterprise Associates, Javelin Venture Partners",2021,Institutional Venture Partners, New Enterprise Associates, Javelin Venture Partners,
326,Dream Games,2.75,2021-06-30,Turkey,Istanbul,Media & Entertainment,"Makers Fund, Index Ventures, Inova Ventures Participacees",2021,Makers Fund, Index Ventures, Inova Ventures Participacees,
327,Transmit Security,2.74,2021-06-22,Israel,Tel Aviv,Enterprise Tech,"General Atlantic, Insight Partners, Vintage Investment Partners",2021,General Atlantic, Insight Partners, Vintage Investment Partners,
328,Hozon Auto,3.95,2022-02-22,China,Shanghai,Industrials,"HD Capital, Qihoo 360 Technology, China Fortune Land Development",2022,HD Capital, Qihoo 360 Technology, China Fortune Land Development,
329,Tradeshift,2.7,2018-05-30,United States,San Francisco,Enterprise Tech,"Notion Capital, Scentan Ventures, Kite Ventures",2018,Notion Capital, Scentan Ventures, Kite Ventures,
330,Nextiva,2.7,2021-09-14,United States,Scottsdale,Enterprise Tech,Goldman Sachs Asset Management,2021,Goldman Sachs Asset Management,,,
331,Tridge,2.7,2022-08-24,South Korea,Seoul,Industrials,"Forest Partners, Softbank Ventures Asia",2022,Forest Partners, Softbank Ventures Asia,,
332,Thought Machine,2.7,2021-11-29,United Kingdom,London,Financial Services,"British Patient Capital, SEB Venture Capital, IQ Capital",2021,British Patient Capital, SEB Venture Capital, IQ Capital,
333,Starling Bank,2.69,2021-03-08,United Kingdom,London,Financial Services,"JTC Group, Qatar Investment Authority, Fidelity Investment",2021,JTC Group, Qatar Investment Authority, Fidelity Investment,
334,Figure,2.68,2024-02-23,United States,Sunnyvale,Industrials,"Intel Capital, Parkway VC, Amazon Industrial Innovation Fund",2024,Intel Capital, Parkway VC, Amazon Industrial Innovation Fund,
335,BackBase,2.66,2022-06-09,Netherlands,Amsterdam,Financial Services,Motive Partners,2022,Motive Partners,,,
336,ManoMano,2.6,2021-07-05,France,Paris,Consumer & Retail,"General Atlantic, Piton Capital, Partech Partners",2021,General Atlantic, Piton Capital, Partech Partners,
337,Sourcegraph,2.62,2021-07-13,United States,San Francisco,Enterprise Tech,"Redpoint Ventures, Goldcrest Capital, Insight Partners",2021,Redpoint Ventures, Goldcrest Capital, Insight Partners,
338,Pendo,2.6,2019-10-17,United States,Raleigh,Enterprise Tech,"Contour Venture Partners, Battery Ventures, Core Capital Partners",2019,Contour Venture Partners, Battery Ventures, Core Capital Partners,
339,Plume,2.6,2021-02-23,United States,Palo Alto,Industrials,"Insight Partners, Jackson Square Ventures, Liberty Gloval Ventures",2021,Insight Partners, Jackson Square Ventures, Liberty Gloval Ventures,
340,Moglix,2.6,2021-05-17,Singapore,Sigapore,Industrials,"Jungle Ventures, Accel, Venture Highway",2021,Jungle Ventures, Accel, Venture Highway,
341,Axonius,2.6,2021-03-01,United States,New York,Enterprise Tech,"Vertex Ventures Israel, Bessemer Venture Partners, Emerge",2021,Vertex Ventures Israel, Bessemer Venture Partners, Emerge,
342,Xinchao Media,2.0,2018-04-09,China,Chengdu,Media & Entertainment,"JD.com, Baidu, Vision Plus Capital",2018,JD.com, Baidu, Vision Plus Capital,
343,JumpCloud,2.62,2021-09-13,United States,Louisville,Enterprise Tech,"Foundry Group, General Atlantic, BlackRock",2021,Foundry Group, General Atlantic, BlackRock,
344,Unico,2.6,2021-08-03,Brazil,Sao Paulo,Enterprise Tech,"Big Bets, General Atlantic, SOFTBANK Latin America Ventures",2021,Big Bets, General Atlantic, SOFTBANK Latin America Ventures,
345,Bending Spoons,2.55,2024-02-15,Italy,Milan,Consumer & Retail,"Durable Capital Partners, Adjacent, Creator Partners",2024,Durable Capital Partners, Adjacent, Creator Partners,
346,Oura,2.55,2022-04-05,Finland,Oulu,Healthcare & Life Sciences,"Forerunner Ventures, Lifeline Ventures, MSD Capital",2022,Forerunner Ventures, Lifeline Ventures, MSD Capital,
347,JUST Egg,2.59,2017-11-30,United States,San Francisco,Consumer & Retail,"Khosla Ventures, Horizons Ventures, Founders Fund",2017,Khosla Ventures, Horizons Ventures, Founders Fund,
348,Groq,2.5,2021-04-14,United States,Mountain View,Enterprise Tech,"TDK Ventures, Social Capital, D1 Capital Partners",2021,TDK Ventures, Social Capital, D1 Capital Partners,
349,Jetti Resources,2.5,2022-10-24,United States,Boulder,Industrials,"BMW i Ventures, BHP Ventures",2022,BMW i Ventures, BHP Ventures,,
350,Claroty,2.5,2021-06-17,United States,New York,Enterprise Tech,"Bessemer Venture Partners, MoreVC, Team8",2021,Bessemer Venture Partners, MoreVC, Team8,
351,Vista Global,2.5,2017-08-23,United Arab Emirates,Dubai,Industrials,Rhone Capital,2017,Rhone Capital,,,
352,BYTON,2.5,2018-04-20,China,Nanjing,Industrials,"FAW Group, Tencent Holdings, Tus Holdings",2018,FAW Group, Tencent Holdings, Tus Holdings,
353,Side,2.5,2021-03-22,United States,San Francisco,Financial Services,"Coatue Managemeny, Trinity Ventures, Matrix Partners",2021,Coatue Managemeny, Trinity Ventures, Matrix Partners,
354,Infra.Market,2.5,2021-02-25,India,Thane,Industrials,"Accel, Tiger Global Management, Nexus Venture Partners",2021,Accel, Tiger Global Management, Nexus Venture Partners,
355,Varo Bank,2.5,2021-09-09,United States,San Francisco,Financial Services,"Warburg Pincus, The Rise Fund, HarbourVest Partners",2021,Warburg Pincus, The Rise Fund, HarbourVest Partners,
356,Cato Networks,3.0,2020-11-17,Israel,Tel Aviv,Enterprise Tech,"Aspect Ventures, SingTel Innov8, Greylock Partners",2020,Aspect Ventures, SingTel Innov8, Greylock Partners,
357,Sword Health,3.0,2021-11-22,United States,New York,Healthcare & Life Sciences,"Khosla Ventures, Green Innovations, Founders Fund",2021,Khosla Ventures, Green Innovations, Founders Fund,
358,Aura,2.5,2021-06-09,United States,Burlington,Consumer & Retail,"Warburg Pincus, General Catalyst",2021,Warburg Pincus, General Catalyst,,
359,Sysdig,2.5,2021-04-28,United States,San Francisco,Enterprise Tech,"Accel, Bain Capital Ventures, Insight Partners",2021,Accel, Bain Capital Ventures, Insight Partners,
360,Zetwerk,2.8,2021-08-20,India,Bengaluru,Industrials,"Sequoia Capital India, Kae Capital, Accel",2021,Sequoia Capital India, Kae Capital, Accel,
361,Uniphore,2.5,2022-02-16,United States,Palo Alto,Enterprise Tech,"Chiratae Ventures, March Capital Partners, National Grid Partners",2022,Chiratae Ventures, March Capital Partners, National Grid Partners,
362,Somatus,2.5,2022-02-23,United States,McLean,Healthcare & Life Sciences,"The Blue Venture Fund, Flare Capital Partners, Longitude Capital",2022,The Blue Venture Fund, Flare Capital Partners, Longitude Capital,
363,Immutable,2.5,2022-03-07,Australia,Sydney,Media & Entertainment,"Fabric Ventures, AirTree Ventures, Temasek",2022,Fabric Ventures, AirTree Ventures, Temasek,
364,SiFive,2.5,2022-03-16,United States,San Mateo,Enterprise Tech,"Sutter Hill Ventures, Osage University Partners, Spark Capital",2022,Sutter Hill Ventures, Osage University Partners, Spark Capital,
365,Games24x7,2.5,2022-03-30,India,Mumbai,Media & Entertainment,"Tiger Global Management, The Raine Group, Malabar Investments",2022,Tiger Global Management, The Raine Group, Malabar Investments,
366,Fetch,2.5,2021-03-31,United States,Madison,Consumer & Retail,"Greycroft, Loeb.NYC, DST Global",2021,Greycroft, Loeb.NYC, DST Global,
367,Coda Payments,2.5,2022-04-15,Singapore,Sigapore,Financial Services,"GIC. Apis Partners, Insight Partners",2022,GIC. Apis Partners, Insight Partners,,
368,DriveNets,2.5,2021-01-27,Israel,Ra'anana,Enterprise Tech,"Bessemer Venture Partners, Pitango Venture Capital, D1 Capital Partners",2021,Bessemer Venture Partners, Pitango Venture Capital, D1 Capital Partners,
369,Hibob,2.45,2021-10-12,Israel,Tel Aviv,Enterprise Tech,"Bessemer Venture Partners, Eight Roads Ventures, Battery Ventures",2021,Bessemer Venture Partners, Eight Roads Ventures, Battery Ventures,
370,Vanta,2.45,2022-06-07,United States,San Francisco,Enterprise Tech,"Craft Ventures, Sequoia Capital, Verissimo Ventures",2022,Craft Ventures, Sequoia Capital, Verissimo Ventures,
371,Uala,2.45,2021-08-13,Argentina,Buenos Aires,Financial Services,"Soros Fund Management, Ribbit Capital, Monashees+",2021,Soros Fund Management, Ribbit Capital, Monashees+,
372,Mobile Premier League,2.45,2021-09-15,India,Bengaluru,Media & Entertainment,"Sequoia Capital India, RTP Global, Go-Ventures",2021,Sequoia Capital India, RTP Global, Go-Ventures,
373,insitro,2.44,2021-03-15,United States,South San Francisco,Healthcare & Life Sciences,"Foresite Capital, ARCH Venture Partners, Third Rock Ventures",2021,Foresite Capital, ARCH Venture Partners, Third Rock Ventures,
374,Cgtz,2.41,2017-02-21,China,Hangzhou,Financial Services,"Shunwei Capital Partners, China Media Group, Guangzhou Huiyin Aofeng Equity Investment Fund",2017,Shunwei Capital Partners, China Media Group, Guangzhou Huiyin Aofeng Equity Investment Fund,
375,Star Charge,2.41,2021-05-19,China,Changzhou,Industrials,"Shunwei Capital Partners, China Media Group, Guangzhou Huiyin Aofeng Equity Investment Fund",2021,Shunwei Capital Partners, China Media Group, Guangzhou Huiyin Aofeng Equity Investment Fund,
376,Carbon,2.4,2015-08-20,United States,Redwood City,Industrials,"Google Ventures, Sequoia Capital, Wakefield Group",2015,Google Ventures, Sequoia Capital, Wakefield Group,
377,Rokt,2.4,2021-12-16,United States,New York,Consumer & Retail,"Square Peg Capital, TDM Growth Partners, Tiger Global Management",2021,Square Peg Capital, TDM Growth Partners, Tiger Global Management,
378,Paxos,2.4,2021-04-29,United States,New York,Financial Services,"Liberty City Ventures, RRE Ventures, Mithril Capital Management",2021,Liberty City Ventures, RRE Ventures, Mithril Capital Management,
379,BitSight Technologies,2.4,2021-09-13,United States,Boston,Enterprise Tech,"Menlo Ventures, GGV Capital, Flybridge Capital Partners",2021,Menlo Ventures, GGV Capital, Flybridge Capital Partners,
380,Trumid,2.4,2020-07-15,United States,New York,Financial Services,"T. Rowe Price, Dragoneer Investment Group, BlackRock",2020,T. Rowe Price, Dragoneer Investment Group, BlackRock,
381,ABL Space Systems,2.4,2021-03-25,United States,El Segundo,Industrials,"T. Rowe Price, Lockheed Martin Ventures, Fidelity Investment",2021,T. Rowe Price, Lockheed Martin Ventures, Fidelity Investment,
382,HoneyBook,2.4,2021-05-04,United States,San Francisco,Enterprise Tech,"Norwest Venture Partners, Hillsven Capital, Aleph",2021,Norwest Venture Partners, Hillsven Capital, Aleph,
383,Beta Technologies,2.4,2022-04-19,United States,South Burlington,Industrials,"The Rise Fund, Fidelity Investments. RedBird Capital Partners",2022,The Rise Fund, Fidelity Investments. RedBird Capital Partners,,
384,Project44,2.62,2021-06-01,United States,Chicago,Enterprise Tech,"Emergence Capital Partners, 8VC, Chicago Ventures",2021,Emergence Capital Partners, 8VC, Chicago Ventures,
385,Freenome,2.62,2020-08-26,United States,South San Francisco,Healthcare & Life Sciences,"Andreessen Horowitz, Data Collective, Roche Venture Fund",2020,Andreessen Horowitz, Data Collective, Roche Venture Fund,
386,ManyPets,2.35,2021-06-01,United Kingdom,London,Insurance,"Octopus Ventures, Munich Re Ventures, CommerzVentures",2021,Octopus Ventures, Munich Re Ventures, CommerzVentures,
387,Jobandtalent,2.35,2021-12-01,Spain,Madrid,Enterprise Tech,"Kibo Ventures, SoftBank Group, Atomico",2021,Kibo Ventures, SoftBank Group, Atomico,
388,WEMAKEPRICE,2.34,2015-09-09,South Korea,Seoul,Consumer & Retail,"IMM Investment, NXC",2015,IMM Investment, NXC,,
389,Biren Technology,2.32,2020-08-18,China,Shanghai,Enterprise Tech,"V FUND, IDG Capital, Green Pine Capital Partners",2020,V FUND, IDG Capital, Green Pine Capital Partners,
390,Transcarent,2.2,2022-01-11,United States,San Francisco,Healthcare & Life Sciences,"Alta Partners, General Catalyst, Jove Equity Partners",2022,Alta Partners, General Catalyst, Jove Equity Partners,
391,Voodoo,2.31,2020-08-17,France,Paris,Media & Entertainment,"Tencent Holdings, Goldman Sachs",2020,Tencent Holdings, Goldman Sachs,,
392,Shield AI,2.8,2021-08-24,United States,San Diego,Industrials,"Andreessen Horowitz, Homebrew, Point72 Ventures",2021,Andreessen Horowitz, Homebrew, Point72 Ventures,
393,PhysicsWallah,2.8,2022-06-07,India,Uttar Pradesh,Consumer & Retail,"GSV Ventures, WestBridge Capital",2022,GSV Ventures, WestBridge Capital,,
394,Uptake,2.3,2015-10-27,United States,Chicago,Industrials,"Revolution, New Enterprise Associates, Caterpillar",2015,Revolution, New Enterprise Associates, Caterpillar,
395,Motive,2.85,2019-04-23,United States,San Francisco,Industrials,"Google Ventures, Index Ventures, Scale Venture Partners",2019,Google Ventures, Index Ventures, Scale Venture Partners,
396,Greenlight,2.3,2020-09-24,United States,Atlanta,Financial Services,"Relay Ventures, TTV Capital, Canapi Ventures",2020,Relay Ventures, TTV Capital, Canapi Ventures,
397,MoMo,2.27,2021-12-10,Vietnam,Ho Chi Minh City,Financial Services,"Goodwater Capital, Warburg Pincus, GS Growth",2021,Goodwater Capital, Warburg Pincus, GS Growth,
398,Story Protocol,2.25,2024-08-21,United States,Bellevue,Media & Entertainment,"A16z Crypto, Andreessen Horowitz, Two Small Fish Ventures",2024,A16z Crypto, Andreessen Horowitz, Two Small Fish Ventures,
399,Algolia,2.25,2021-07-28,United States,San Francisco,Enterprise Tech,"Accel, Alven Capital, Storm Ventures",2021,Accel, Alven Capital, Storm Ventures,
400,Pattern,2.25,2021-10-06,United States,Lehi,Consumer & Retail,"Knox Lane, Ainge Advisory, Carlson Private Capital Partners",2021,Knox Lane, Ainge Advisory, Carlson Private Capital Partners,
401,Newfront Insurance,2.2,2022-04-12,United States,San Francisco,Insurance,"Founders Fund, Meritech Capital Partners, GS Growth",2022,Founders Fund, Meritech Capital Partners, GS Growth,
402,NuCom Group,2.2,2018-02-22,Germany,Unterfoehring,Consumer & Retail,General Atlantic,2018,General Atlantic,,,
403,Skydio,2.2,2021-02-25,United States,Redwood City,Industrials,"Andreessen Horowitz, Andreessen Horowitz, Institutional Venture Partners, Accel",2021,Andreessen Horowitz, Andreessen Horowitz, Institutional Venture Partners, Accel
404,MUSINSA,2.76,2019-11-11,South Korea,Seoul,Consumer & Retail,Sequoia Capital,2019,Sequoia Capital,,,
405,Current,2.2,2021-04-27,United States,New York,Financial Services,"Expa, QED Investors, Foundation Capital",2021,Expa, QED Investors, Foundation Capital,
406,Bitso,2.2,2021-05-05,Mexico,Mexico City,Financial Services,"Pantera Capital, QED Investors, Coinbase Ventures",2021,Pantera Capital, QED Investors, Coinbase Ventures,
407,Gympass,2.4,2019-06-12,United States,New York,Healthcare & Life Sciences,"General Atlantic, SoftBank Group, Atomico",2019,General Atlantic, SoftBank Group, Atomico,
408,Dialpad,2.2,2020-10-06,United States,San Francisco,Enterprise Tech,"Andreessen Horowitz, Google Ventures, Section 32",2020,Andreessen Horowitz, Google Ventures, Section 32,
409,G7 Networks,2.2,2022-02-15,China,Beijing,Industrials,"Eastern Bell Capital 32, SDIC CMC Investment Management, Trustbridge Partners",2022,Eastern Bell Capital 32, SDIC CMC Investment Management, Trustbridge Partners,
410,BloomReach,2.2,2022-02-23,United States,Mountain View,Consumer & Retail,"Bain Capital Ventures, Sixth Street Growth, Lightspeed Venture Partners",2022,Bain Capital Ventures, Sixth Street Growth, Lightspeed Venture Partners,
411,Motif FoodWorks,2.2,2021-06-16,United States,Boston,Industrials,"General Atlantic, Breakthrough Energy Ventures, Viking Global Investors",2021,General Atlantic, Breakthrough Energy Ventures, Viking Global Investors,
412,Accelerant,2.4,2022-01-12,United Kingdom,Colchester,Insurance,"Deer Park Road, Altamont Capital Partners, Eldridge",2022,Deer Park Road, Altamont Capital Partners, Eldridge,
413,YITU Technology,2.17,2018-03-08,China,Shanghai,Enterprise Tech,"Sequoia Capital China, Banyan Capital",2018,Sequoia Capital China, Banyan Capital,,
414,Addepar,2.17,2021-06-15,United States,Mountain View,Financial Services,"8VC, D1 Capital Partners, Sway Ventures",2021,8VC, D1 Capital Partners, Sway Ventures,
415,Qualia,2.17,2020-12-21,United States,San Francisco,Financial Services,"8VC, Menlo Ventures, Tiger Global Management",2020,8VC, Menlo Ventures, Tiger Global Management,
416,Neo4j,2.0,2021-06-17,United States,San Mateo,Enterprise Tech,"Eight Roads Ventures, One Peak Partners, Creandum",2021,Eight Roads Ventures, One Peak Partners, Creandum,
417,CloudWalk,2.15,2021-09-08,Brazil,Sao Paulo,Financial Services,"Plug and Play Ventures, Valor Capital Group, DST Global",2021,Plug and Play Ventures, Valor Capital Group, DST Global,
418,Xaira Therapeutics,2.15,2024-04-23,United States,San Francisco,Healthcare & Life Sciences,"ARCH Venture Partners, Foresite Capital, Two Sigma Ventures",2024,ARCH Venture Partners, Foresite Capital, Two Sigma Ventures,
419,CoinDCX,2.15,2021-08-10,India,Maharashtra,Financial Services,"Polychain Capital, Coinbase Ventures, Jump Capital",2021,Polychain Capital, Coinbase Ventures, Jump Capital,
420,Eightfold,2.1,2020-10-27,United States,Santa Clara,Enterprise Tech,"Foundation Capital, Institutional Venture Partners, General Catalyst",2020,Foundation Capital, Institutional Venture Partners, General Catalyst,
421,Urban Company,2.1,2021-04-27,India,Gurgaon,Consumer & Retail,"VY Capital, Accel, Elevation Capital",2021,VY Capital, Accel, Elevation Capital,
422,Moveworks,2.1,2021-06-30,United States,Mountain View,Enterprise Tech,"Lightspeed Venture Partners, Sapphire Ventures, Kleiner Perkins Caufield & Byers",2021,Lightspeed Venture Partners, Sapphire Ventures, Kleiner Perkins Caufield & Byers,
423,Medable,2.1,2021-10-26,United States,Palo Alto,Healthcare & Life Sciences,"GSR Ventures, Sapphire Ventures, Streamlined Ventures",2021,GSR Ventures, Sapphire Ventures, Streamlined Ventures,
424,GoCardless,2.1,2022-02-08,United Kingdom,London,Financial Services,"Accel, Passion Capital, Balderton Capital",2022,Accel, Passion Capital, Balderton Capital,
425,Aledade,3.5,2021-01-19,United States,Bethesda,Healthcare & Life Sciences,"Venrock, CVF Capital Partners, ARCH Venture Partners",2021,Venrock, CVF Capital Partners, ARCH Venture Partners,
426,A24 Films,3.5,2022-03-09,United States,New York,Media & Entertainment,"Stripes Group, Neuberger Berman",2022,Stripes Group, Neuberger Berman,,
427,Forto,2.1,2021-06-21,Germany,Berlin,Industrials,"Cherry Ventures, Northzone Ventures, Global Founders Capital",2021,Cherry Ventures, Northzone Ventures, Global Founders Capital,
428,Jeeves,2.1,2022-03-14,United States,Orlando,Enterprise Tech,"Tencent Holdings, CRV, Clocktower Technology Ventures",2022,Tencent Holdings, CRV, Clocktower Technology Ventures,
429,Viva Wallet,2.05,2022-12-17,Greece,Athens,Financial Services,"Breyer Capital, Hedosophia",2022,Breyer Capital, Hedosophia,,
430,DeepL,2.0,2023-01-11,Germany,Cologne,Enterprise Tech,"Benchmark, btov Partners, Bessemer Venture Partners",2023,Benchmark, btov Partners, Bessemer Venture Partners,
431,Cognition AI,2.0,2024-04-24,United States,San Francisco,Enterprise Tech,"Founders Fund, Khosla Ventures",2024,Founders Fund, Khosla Ventures,,
432,Babel Finance,2.0,2022-05-25,Hong Kong,Hong Kong,Financial Services,"Dragonfly Capital, BAI Capital, 10T Fund",2022,Dragonfly Capital, BAI Capital, 10T Fund,
